{
  "$schema": "https://json-schema.org/draft/2020-12/schema",
  "$id": "https://reidsurmeier.wtf/schemas/blind-review-packet.schema.json",
  "title": "Blind Review Packet",
  "description": "The complete input handed to a blind artifact reviewer. The packet is the reviewer's entire view of the candidate; anything not named here is withheld by design.",
  "type": "object",
  "required": [
    "schema_version",
    "issue",
    "candidate_commit",
    "acceptance_contract",
    "references",
    "candidate",
    "launch"
  ],
  "properties": {
    "schema_version": {"const": 1},
    "issue": {
      "type": "integer",
      "minimum": 1,
      "description": "The authoritative GitHub Issue holding the acceptance contract."
    },
    "pull_request": {
      "type": "integer",
      "minimum": 1,
      "description": "The pull request carrying the candidate commit and the verdict labels."
    },
    "candidate_commit": {
      "type": "string",
      "pattern": "^[0-9a-f]{40}$",
      "description": "Exact full SHA of the candidate. Every verdict binds to this SHA."
    },
    "acceptance_contract": {
      "type": "string",
      "minLength": 1,
      "description": "Repository-relative path to the approved acceptance contract."
    },
    "references": {
      "type": "array",
      "minItems": 1,
      "items": {
        "type": "object",
        "required": ["path", "sha256"],
        "properties": {
          "path": {"type": "string", "minLength": 1},
          "sha256": {"type": "string", "pattern": "^[0-9a-f]{64}$"}
        },
        "additionalProperties": false
      },
      "description": "Authoritative reference artifacts, each hash-locked."
    },
    "candidate": {
      "type": "object",
      "required": ["evidence"],
      "properties": {
        "artifact_url": {
          "type": "string",
          "description": "Immutable URL of a playable or viewable candidate build, when one exists."
        },
        "evidence": {
          "type": "array",
          "minItems": 1,
          "items": {"type": "string", "minLength": 1},
          "description": "Repository-relative paths to required candidate evidence (captures, reports, manifests)."
        }
      },
      "additionalProperties": false
    },
    "launch": {
      "type": "object",
      "required": ["command"],
      "properties": {
        "command": {
          "type": "string",
          "minLength": 1,
          "description": "Deterministic command that launches the candidate."
        },
        "clean_state_command": {
          "type": "string",
          "minLength": 1,
          "description": "Command that resets the candidate to a clean state between playtest rounds."
        }
      },
      "additionalProperties": false
    }
  },
  "additionalProperties": false
}
