{
  "schema_version": 1,
  "issue": 86,
  "candidate_commit": "d866b0dbde4a33a8a484fcd49b2e42b06d12021b",
  "acceptance_contract": "docs/reviews/issue-86-contract.md",
  "references": [
    {
      "path": "artifacts/references/ro-hud-fullscreen/reference-native.png",
      "sha256": "1b7af8b2c3b1be3e5dd7514b689c75a8576651bcb99d6e62536800df8068c8de"
    },
    {
      "path": "artifacts/references/ro-hud-fullscreen/window-rects.json",
      "sha256": "ae6851fe73ec78536ec1163883f046d924ddb2606e7238efa1d31ea3254f439f"
    }
  ],
  "candidate": {
    "evidence": [
      "artifacts/references/ro-hud-fullscreen/replica-capture-round10.png",
      "artifacts/references/ro-hud-fullscreen/round14/playtest-initial.png"
    ]
  },
  "launch": {
    "command": "rm -rf /tmp/g && cp -r /workspace/godot /tmp/g && xvfb-run --auto-servernum godot --path /tmp/g",
    "clean_state_command": "rm -rf /tmp/g && cp -r /workspace/godot /tmp/g"
  }
}